<?xml version="1.0" encoding="UTF-8"?>
<!DOCTYPE ColumnComponents SYSTEM "ColumnComponents.dtd">

<ColumnComponents>
    <ColumnComponent class="sk.magiksoft.sodalis.core.filter.element.NoComparatorDateColumnComponent">
        <label_text>Od</label_text>
        <from>sk.magiksoft.sodalis.event.entity.Event e</from>
        <where><![CDATA[e.startTime >= {0} or (e.repeatMask<>0 and e.repeatStart >= {0})]]></where>
    </ColumnComponent>
    <ColumnComponent class="sk.magiksoft.sodalis.core.filter.element.NoComparatorDateColumnComponent">
        <label_text>Do</label_text>
        <from>sk.magiksoft.sodalis.event.entity.Event e</from>
        <where>
            <![CDATA[DATEADD(''DAY'',-1,e.endTime) <= {0} or (e.repeatMask<>0 and DATEADD(''DAY'',1,e.repeatEnd) <= {0})]]></where>
    </ColumnComponent>
    <ColumnComponent class="sk.magiksoft.sodalis.core.filter.element.TextFieldColumnComponent">
        <label_text>NÃ¡zov udalosti</label_text>
        <from>sk.magiksoft.sodalis.event.entity.Event e</from>
        <where>upper(remove_diacritics(e.eventName)) {0} {1}</where>
    </ColumnComponent>
    <ColumnComponent class="sk.magiksoft.sodalis.core.filter.element.TextFieldColumnComponent">
        <label_text>Miesto</label_text>
        <from>sk.magiksoft.sodalis.event.entity.Event e</from>
        <where>upper(remove_diacritics(e.place)) {0} {1}</where>
    </ColumnComponent>
    <ColumnComponent class="sk.magiksoft.sodalis.event.filter.EventTypeColumnComponent">
        <label_text>Typ udalosti</label_text>
        <from>sk.magiksoft.sodalis.event.entity.Event e</from>
        <where>e.eventType.id {0} {1}</where>
    </ColumnComponent>
</ColumnComponents>
